{
  "coord": {
    "lon": -0.13,
    "lat": 51.51
  },
  "weather": [{
    "id": 802,
    "main": "Clouds",
    "description": "scattered clouds",
    "icon": "03d"
  }],
  "base": "cmc stations",
  "main": {
    "temp": 284.4,
    "pressure": 1020,
    "humidity": 71,
    "temp_min": 283.15,
    "temp_max": 285.15
  },
  "wind": {
    "speed": 10.8,
    "deg": 220,
    "gust": 15.9
  },
  "clouds": {
    "all": 40
  },
  "dt": 1449303600,
  "sys": {
    "type": 1,
    "id": 5093,
    "message": 0.0081,
    "country": "GB",
    "sunrise": 1449301749,
    "sunset": 1449330774
  },
  "id": 2643743,
  "name": "London",
  "cod": 200
}
